{
  "scenario_id": "demo_case_01",
  "run_mode": "learned",
  "bayesian_model": "learned_cpt",
  "weights_used": {
    "trapped": {
      "sos": 0.35,
      "collapse": 0.3,
      "human_activity": 0.2,
      "smoke": 0.15
    },
    "passability": {
      "road_damage": 0.45,
      "fire_risk": 0.35,
      "congestion": 0.2,
      "drone_confidence": 0.0
    },
    "life_risk": {
      "fire": 0.4,
      "trapped_prob": 0.35,
      "time_urgency": 0.25
    },
    "priority": {
      "trapped_prob": 0.4,
      "life_risk": 0.3,
      "time_urgency": 0.2,
      "accessibility": 0.1
    },
    "utility": {
      "alpha": 0.3,
      "beta": 0.25,
      "gamma": 0.2,
      "delta": 0.15,
      "epsilon": 0.1,
      "zeta": 0.1
    },
    "astar_risk": {
      "fire": 0.35,
      "damage": 0.25,
      "congestion": 0.2,
      "secondary": 0.2
    }
  },
  "zone_assessment": [
    {
      "zone_id": "A",
      "node_id": "ZONE_A",
      "trapped_prob": 0.936,
      "passability_prob": 0.618748,
      "life_risk": 0.7476,
      "priority_score": 0.820555,
      "inference_model": "learned_cpt",
      "bayesian_evidence": {
        "hazard_intensity": "high",
        "building_damage": "high",
        "fire_severity": "medium",
        "smoke_level": "high",
        "sos_signal": "high",
        "human_activity": "medium",
        "road_damage": "medium",
        "congestion": "low",
        "drone_road_report": "uncertain"
      },
      "trapped_explanation": {
        "query": "trapped_people",
        "target_state": "yes",
        "posterior": 0.9359999999999999,
        "contributions": [
          {
            "evidence": "sos_signal",
            "state": "high",
            "posterior_without": 0.47456645,
            "delta": 0.46143355
          },
          {
            "evidence": "smoke_level",
            "state": "high",
            "posterior_without": 0.82412735,
            "delta": 0.11187265
          },
          {
            "evidence": "human_activity",
            "state": "medium",
            "posterior_without": 0.86165445,
            "delta": 0.07434555
          },
          {
            "evidence": "building_damage",
            "state": "high",
            "posterior_without": 0.86512412,
            "delta": 0.07087588
          },
          {
            "evidence": "fire_severity",
            "state": "medium",
            "posterior_without": 0.97844074,
            "delta": -0.04244074
          },
          {
            "evidence": "hazard_intensity",
            "state": "high",
            "posterior_without": 0.936,
            "delta": 0.0
          }
        ]
      },
      "passability_explanation": {
        "query": "road_passable",
        "target_state": "yes",
        "posterior": 0.618748495788207,
        "contributions": [
          {
            "evidence": "fire_severity",
            "state": "medium",
            "posterior_without": 0.45279093,
            "delta": 0.16595757
          },
          {
            "evidence": "road_damage",
            "state": "medium",
            "posterior_without": 0.5027182,
            "delta": 0.11603029
          },
          {
            "evidence": "congestion",
            "state": "low",
            "posterior_without": 0.55979335,
            "delta": 0.05895514
          },
          {
            "evidence": "drone_road_report",
            "state": "uncertain",
            "posterior_without": 0.62309205,
            "delta": -0.00434355
          },
          {
            "evidence": "hazard_intensity",
            "state": "high",
            "posterior_without": 0.6187485,
            "delta": 0.0
          }
        ]
      }
    },
    {
      "zone_id": "C",
      "node_id": "ZONE_C",
      "trapped_prob": 0.765357,
      "passability_prob": 0.94107,
      "life_risk": 0.692875,
      "priority_score": 0.788112,
      "inference_model": "learned_cpt",
      "bayesian_evidence": {
        "hazard_intensity": "high",
        "building_damage": "medium",
        "fire_severity": "medium",
        "smoke_level": "high",
        "sos_signal": "high",
        "human_activity": "medium",
        "road_damage": "low",
        "congestion": "low",
        "drone_road_report": "open"
      },
      "trapped_explanation": {
        "query": "trapped_people",
        "target_state": "yes",
        "posterior": 0.7653571428571428,
        "contributions": [
          {
            "evidence": "sos_signal",
            "state": "high",
            "posterior_without": 0.49197984,
            "delta": 0.27337731
          },
          {
            "evidence": "fire_severity",
            "state": "medium",
            "posterior_without": 0.93840912,
            "delta": -0.17305198
          },
          {
            "evidence": "building_damage",
            "state": "medium",
            "posterior_without": 0.86512412,
            "delta": -0.09976698
          },
          {
            "evidence": "smoke_level",
            "state": "high",
            "posterior_without": 0.70956061,
            "delta": 0.05579653
          },
          {
            "evidence": "human_activity",
            "state": "medium",
            "posterior_without": 0.81537398,
            "delta": -0.05001684
          },
          {
            "evidence": "hazard_intensity",
            "state": "high",
            "posterior_without": 0.76535714,
            "delta": 0.0
          }
        ]
      },
      "passability_explanation": {
        "query": "road_passable",
        "target_state": "yes",
        "posterior": 0.9410695187165776,
        "contributions": [
          {
            "evidence": "road_damage",
            "state": "low",
            "posterior_without": 0.73216205,
            "delta": 0.20890747
          },
          {
            "evidence": "drone_road_report",
            "state": "open",
            "posterior_without": 0.77762039,
            "delta": 0.16344913
          },
          {
            "evidence": "fire_severity",
            "state": "medium",
            "posterior_without": 0.90490913,
            "delta": 0.03616039
          },
          {
            "evidence": "congestion",
            "state": "low",
            "posterior_without": 0.94568226,
            "delta": -0.00461274
          },
          {
            "evidence": "hazard_intensity",
            "state": "high",
            "posterior_without": 0.94106952,
            "delta": 0.0
          }
        ]
      }
    },
    {
      "zone_id": "B",
      "node_id": "ZONE_B",
      "trapped_prob": 0.050173,
      "passability_prob": 0.907977,
      "life_risk": 0.17256,
      "priority_score": 0.222635,
      "inference_model": "learned_cpt",
      "bayesian_evidence": {
        "hazard_intensity": "low",
        "building_damage": "low",
        "fire_severity": "low",
        "smoke_level": "low",
        "sos_signal": "low",
        "human_activity": "low",
        "road_damage": "low",
        "congestion": "low",
        "drone_road_report": "uncertain"
      },
      "trapped_explanation": {
        "query": "trapped_people",
        "target_state": "yes",
        "posterior": 0.050172853499574954,
        "contributions": [
          {
            "evidence": "sos_signal",
            "state": "low",
            "posterior_without": 0.15303105,
            "delta": -0.1028582
          },
          {
            "evidence": "human_activity",
            "state": "low",
            "posterior_without": 0.11246129,
            "delta": -0.06228844
          },
          {
            "evidence": "building_damage",
            "state": "low",
            "posterior_without": 0.06818878,
            "delta": -0.01801593
          },
          {
            "evidence": "smoke_level",
            "state": "low",
            "posterior_without": 0.05177889,
            "delta": -0.00160603
          },
          {
            "evidence": "fire_severity",
            "state": "low",
            "posterior_without": 0.05152561,
            "delta": -0.00135276
          },
          {
            "evidence": "hazard_intensity",
            "state": "low",
            "posterior_without": 0.05017285,
            "delta": 0.0
          }
        ]
      },
      "passability_explanation": {
        "query": "road_passable",
        "target_state": "yes",
        "posterior": 0.9079767737252766,
        "contributions": [
          {
            "evidence": "congestion",
            "state": "low",
            "posterior_without": 0.85710771,
            "delta": 0.05086906
          },
          {
            "evidence": "fire_severity",
            "state": "low",
            "posterior_without": 0.87042149,
            "delta": 0.03755528
          },
          {
            "evidence": "road_damage",
            "state": "low",
            "posterior_without": 0.8753024,
            "delta": 0.03267438
          },
          {
            "evidence": "drone_road_report",
            "state": "uncertain",
            "posterior_without": 0.88528425,
            "delta": 0.02269253
          },
          {
            "evidence": "hazard_intensity",
            "state": "low",
            "posterior_without": 0.90797677,
            "delta": 0.0
          }
        ]
      }
    }
  ],
  "assignments": [
    {
      "unit_id": "RescueCar-1",
      "target_zone": "A",
      "mission_type": "rescue",
      "expected_utility": 0.4802,
      "estimated_people": 4,
      "reason": "派遣 RescueCar-1 前往 A区：救援收益 0.591，到达、路径与资源成本合计 0.111，总期望效用 0.480。",
      "feasibility_reason": "feasible",
      "explanation": "派遣 RescueCar-1 前往 A区：救援收益 0.591，到达、路径与资源成本合计 0.111，总期望效用 0.480。",
      "resource_cost": 0.5,
      "utility_inputs": {
        "trapped_prob": 0.936,
        "life_risk": 0.7476,
        "accessibility": 0.618748,
        "arrival_time_normalized": 0.333333,
        "path_risk": 0.1125,
        "resource_cost": 0.5